[
  {
    "id": "iVAE",
    "aliases": [],
    "version": "0.0.0-author",
    "modalities": ["scrna"],
    "maxScale": "gt_200k",
    "outputs": ["latent", "pseudotime", "branch", "metadata"],
    "requiredPriors": [],
    "supportedGoals": ["latent_representation"],
    "resourceTier": 2,
    "installCommand": "python -m pip install ivae==0.0.0-author",
    "license": "See paper; author-catalog identity only",
    "sourceUrl": "https://doi.org/10.1186/s12915-025-02315-7",
    "docsUrl": "https://doi.org/10.1186/s12915-025-02315-7",
    "paperUrl": "https://doi.org/10.1186/s12915-025-02315-7",
    "executable": false
  },
  {
    "id": "CCVGAE",
    "aliases": [],
    "version": "0.0.0-author",
    "modalities": ["scrna"],
    "maxScale": "gt_200k",
    "outputs": ["latent", "pseudotime", "branch", "metadata"],
    "requiredPriors": [],
    "supportedGoals": ["latent_representation"],
    "resourceTier": 2,
    "installCommand": "python -m pip install ccvgae==0.0.0-author",
    "license": "See paper; author-catalog identity only",
    "sourceUrl": "https://www.sciencedirect.com/journal/array",
    "docsUrl": "https://www.sciencedirect.com/journal/array/100808",
    "paperUrl": "https://www.sciencedirect.com/journal/array",
    "executable": false
  },
  {
    "id": "LiVAE",
    "aliases": [],
    "version": "0.0.0-author",
    "modalities": ["scrna"],
    "maxScale": "gt_200k",
    "outputs": ["latent", "pseudotime", "branch", "metadata"],
    "requiredPriors": [],
    "supportedGoals": ["latent_representation"],
    "resourceTier": 2,
    "installCommand": "python -m pip install livae==0.0.0-author",
    "license": "See paper; author-catalog identity only",
    "sourceUrl": "https://doi.org/10.3389/fgene.2025.1713727",
    "docsUrl": "https://doi.org/10.3389/fgene.2025.1713727",
    "paperUrl": "https://doi.org/10.3389/fgene.2025.1713727",
    "executable": false
  },
  {
    "id": "GAHIB",
    "aliases": [],
    "version": "0.0.0-author",
    "modalities": ["scrna"],
    "maxScale": "gt_200k",
    "outputs": ["latent", "pseudotime", "branch", "metadata"],
    "requiredPriors": [],
    "supportedGoals": ["latent_representation"],
    "resourceTier": 2,
    "installCommand": "python -m pip install gahib==0.0.0-author",
    "license": "See paper; author-catalog identity only",
    "sourceUrl": "https://doi.org/10.3389/fgene.2026.1863100",
    "docsUrl": "https://doi.org/10.3389/fgene.2026.1863100",
    "paperUrl": "https://doi.org/10.3389/fgene.2026.1863100",
    "executable": false
  },
  {
    "id": "MCCVAE",
    "aliases": [],
    "version": "0.0.0-author",
    "modalities": ["scrna"],
    "maxScale": "gt_200k",
    "outputs": ["latent", "pseudotime", "branch", "metadata"],
    "requiredPriors": [],
    "supportedGoals": ["latent_representation"],
    "resourceTier": 2,
    "installCommand": "python -m pip install mccvae==0.0.0-author",
    "license": "See paper; author-catalog identity only",
    "sourceUrl": "https://doi.org/10.1016/j.bspc.2026.110376",
    "docsUrl": "https://doi.org/10.1016/j.bspc.2026.110376",
    "paperUrl": "https://doi.org/10.1016/j.bspc.2026.110376",
    "executable": false
  },
  {
    "id": "GNODEVAE",
    "aliases": [],
    "version": "0.0.0-author",
    "modalities": ["scrna"],
    "maxScale": "gt_200k",
    "outputs": ["latent", "pseudotime", "branch", "metadata"],
    "requiredPriors": [],
    "supportedGoals": ["trajectory_reconstruction"],
    "resourceTier": 2,
    "installCommand": "python -m pip install gnodevae==0.0.0-author",
    "license": "See paper; author-catalog identity only",
    "sourceUrl": "https://doi.org/10.1186/s12864-025-11946-7",
    "docsUrl": "https://doi.org/10.1186/s12864-025-11946-7",
    "paperUrl": "https://doi.org/10.1186/s12864-025-11946-7",
    "executable": false
  },
  {
    "id": "CODE",
    "aliases": [],
    "version": "0.0.0-author",
    "modalities": ["scrna"],
    "maxScale": "gt_200k",
    "outputs": ["latent", "pseudotime", "branch", "metadata"],
    "requiredPriors": [],
    "supportedGoals": ["trajectory_reconstruction"],
    "resourceTier": 2,
    "installCommand": "python -m pip install code-latent==0.0.0-author",
    "license": "See paper; author-catalog identity only",
    "sourceUrl": "https://doi.org/10.1016/j.compbiomed.2025.111115",
    "docsUrl": "https://doi.org/10.1016/j.compbiomed.2025.111115",
    "paperUrl": "https://doi.org/10.1016/j.compbiomed.2025.111115",
    "executable": false
  },
  {
    "id": "iAODE",
    "aliases": [],
    "version": "0.0.0-author",
    "modalities": ["scrna"],
    "maxScale": "gt_200k",
    "outputs": ["latent", "pseudotime", "branch", "metadata"],
    "requiredPriors": [],
    "supportedGoals": ["trajectory_reconstruction"],
    "resourceTier": 2,
    "installCommand": "python -m pip install iaode==0.0.0-author",
    "license": "See paper; author-catalog identity only",
    "sourceUrl": "https://doi.org/10.1038/s42003-026-09768-8",
    "docsUrl": "https://doi.org/10.1038/s42003-026-09768-8",
    "paperUrl": "https://doi.org/10.1038/s42003-026-09768-8",
    "executable": false
  },
  {
    "id": "LAIOR",
    "aliases": [],
    "version": "0.0.0-author",
    "modalities": ["scrna"],
    "maxScale": "gt_200k",
    "outputs": ["latent", "pseudotime", "branch", "metadata"],
    "requiredPriors": [],
    "supportedGoals": ["trajectory_reconstruction", "fate_decision"],
    "resourceTier": 2,
    "installCommand": "python -m pip install laior==0.0.0-author",
    "license": "See paper; author-catalog identity only",
    "sourceUrl": "https://doi.org/10.3389/fgene.2026.1838613",
    "docsUrl": "https://doi.org/10.3389/fgene.2026.1838613",
    "paperUrl": "https://doi.org/10.3389/fgene.2026.1838613",
    "executable": false
  },
  {
    "id": "scRL",
    "aliases": [],
    "version": "0.0.0-author",
    "modalities": ["scrna"],
    "maxScale": "gt_200k",
    "outputs": ["latent", "pseudotime", "branch", "metadata"],
    "requiredPriors": [],
    "supportedGoals": ["fate_decision", "lineage_contribution"],
    "resourceTier": 2,
    "installCommand": "python -m pip install scrl==0.0.0-author",
    "license": "See paper; author-catalog identity only",
    "sourceUrl": "https://doi.org/10.3390/biology14060679",
    "docsUrl": "https://doi.org/10.3390/biology14060679",
    "paperUrl": "https://doi.org/10.3390/biology14060679",
    "executable": false
  },
  {
    "id": "scFocus",
    "aliases": [],
    "version": "0.0.0-author",
    "modalities": ["scrna"],
    "maxScale": "gt_200k",
    "outputs": ["latent", "pseudotime", "branch", "metadata"],
    "requiredPriors": [],
    "supportedGoals": ["fate_decision", "lineage_contribution"],
    "resourceTier": 2,
    "installCommand": "python -m pip install scfocus==0.0.0-author",
    "license": "See paper; author-catalog identity only",
    "sourceUrl": "https://doi.org/10.1016/j.csbj.2025.04.036",
    "docsUrl": "https://doi.org/10.1016/j.csbj.2025.04.036",
    "paperUrl": "https://doi.org/10.1016/j.csbj.2025.04.036",
    "executable": false
  },
  {
    "id": "CLOP-DiT",
    "aliases": [],
    "version": "0.0.0-author",
    "modalities": ["scrna"],
    "maxScale": "gt_200k",
    "outputs": ["latent", "pseudotime", "branch", "metadata"],
    "requiredPriors": [],
    "supportedGoals": ["latent_representation"],
    "resourceTier": 2,
    "installCommand": "python -m pip install clop-dit==0.0.0-author",
    "license": "See paper; author-catalog identity only",
    "sourceUrl": "https://www.sciencedirect.com/journal/array",
    "docsUrl": "https://www.sciencedirect.com/journal/array/100934",
    "paperUrl": "https://www.sciencedirect.com/journal/array",
    "executable": false
  },
  {
    "id": "scCCVGBen",
    "aliases": [],
    "version": "0.0.0-author",
    "modalities": ["scrna"],
    "maxScale": "gt_200k",
    "outputs": ["latent", "pseudotime", "branch", "metadata"],
    "requiredPriors": [],
    "supportedGoals": ["latent_representation"],
    "resourceTier": 2,
    "installCommand": "python -m pip install scccvgben==0.0.0-author",
    "license": "See paper; author-catalog identity only",
    "sourceUrl": "https://doi.org/10.3389/fgene.2026.1822168",
    "docsUrl": "https://doi.org/10.3389/fgene.2026.1822168",
    "paperUrl": "https://doi.org/10.3389/fgene.2026.1822168",
    "executable": false
  }
]
